date,title,body,tag,link
2025-09-01,CAPE accepted at MICCAI 2025,"Lab members Elyar Esmaeilzadeh, Ehsan Garaaghaji and Farzad Hallaji Azad, with Dr. Doruk Öner, present CAPE — a Connectivity-Aware Path Enforcement loss for curvilinear structure delineation — at MICCAI 2025.",Publication,publications.html
2025-02-01,Detecting bronchiolitis obliterans from chest CT,Our collaborative work harnessing deep learning to detect bronchiolitis obliterans syndrome from chest CT appears in Communications Medicine.,Publication,publications.html
2025-01-15,PartSDF published in TMLR,"PartSDF, a part-based implicit neural representation for composite 3D shape parametrization and optimization, is published in Transactions on Machine Learning Research.",Publication,publications.html
2024-07-01,Uncertainty estimation in iterative neural networks at ICML 2024,Our method for enabling efficient uncertainty estimation in iterative neural networks is presented at ICML 2024.,Publication,publications.html
2024-09-01,NeuraVision Research Lab established at Bilkent University,"Dr. Doruk Öner founds the NeuraVision Research Lab in the Department of Computer Engineering at Bilkent University, focusing on topology-aware computer vision and trustworthy deep learning.",Lab,
